{
  "schema_version": "outcome-closure-receipt.v1", "workflow_id": "outcome:CASE_006:1", "case_id": "CASE_006", "receipt_id": "CLOSURE_RECEIPT_001", "receipt_hash": "2323232323232323232323232323232323232323232323232323232323232323", "approval_receipt_ref": "urn:decision-receipt:006", "approval_receipt_hash": "2424242424242424242424242424242424242424242424242424242424242424", "approved_action_snapshot_ref": "urn:approved-action:006", "approved_action_snapshot_hash": "2525252525252525252525252525252525252525252525252525252525252525", "required_operation_set_ref": "urn:operation-set:006", "required_operation_set_hash": "2626262626262626262626262626262626262626262626262626262626262626", "required_operation_count": 1,
  "terminal_receipt_set_ref": "urn:terminal-receipts:006", "terminal_receipt_set_hash": "2727272727272727272727272727272727272727272727272727272727272727", "closed_snapshot_ref": "urn:closed-snapshot:006", "closed_snapshot_hash": "2828282828282828282828282828282828282828282828282828282828282828", "final_case_revision": 50,
  "unresolved_ambiguous_count": 0, "failed_required_receipt_count": 0, "in_flight_operation_count": 0, "in_flight_compensation_count": 0, "unresolved_manual_recovery_count": 0, "closed_at": "2026-07-24T08:12:00Z", "epoch": 1, "source_revision": 49, "revision": 50, "fence": 8, "committed_event_sequence": 10, "synthetic_noop": false
}
